node_1|node_1_type|node_2|node_2_type|edge|chunk_id
parent training|service|conduct problems|condition|associated with a moderate reduction in parent-reported ADHD symptoms and conduct problems|0434b8b4884f44479ac015ed1fadef35
adhd|concept|conduct problems|concept|independently assessed|5cec37bb224d4f6392290ee3b0a0654f
adhd|concept|negative parenting|concept|small reduction in, as reported by independent assessments|5cec37bb224d4f6392290ee3b0a0654f
cognitive behavior therapy (cbt)|concept|adhd|concept|found associations with moderate improvements in, for adults with|5cec37bb224d4f6392290ee3b0a0654f
cognitive behavior therapy (cbt)|concept|self-report measures|concept|found associations with moderate improvements in, for adults with|5cec37bb224d4f6392290ee3b0a0654f
negative parenting|concept|adhd symptoms|concept|small reduction in, as reported by independent assessments, is associated with|5cec37bb224d4f6392290ee3b0a0654f
adhd|condition|symptoms|documents|ADHD symptoms are related to ADHD condition|25dc96f839c844588d15761db41147f3
cbt|service|improvements|concept|CBT led to improvements in adult ADHD patients|25dc96f839c844588d15761db41147f3
cognitive training|service|executive functioning|concept|Cognitive training resulted in small to moderate improvements in executive functioning in preschoolers with ADHD|25dc96f839c844588d15761db41147f3
meditation-based therapy|service|adhd symptoms|documents|Meditation-based therapy resulted in moderate reductions in ADHD symptoms in both children and adults|25dc96f839c844588d15761db41147f3
social skills training|service|improvements|concept|Social skills training for youth with ADHD did not improve|25dc96f839c844588d15761db41147f3
adhd|condition|social skills training|service|The study found that social skills training for youth with ADHD did not improve general behavior.|0564a387d43649b98d9f87ddcb450858
youth|person|adhd|condition|Youth with ADHD were the subject of the social skills training study.|0564a387d43649b98d9f87ddcb450858
teacher-assessed social skills|concept|social skills training|service|The study found that teacher-assessed social skills did not improve with social skills training.|0564a387d43649b98d9f87ddcb450858
general behavior|concept|social skills training|service|The study found that general behavior did not improve with social skills training.|0564a387d43649b98d9f87ddcb450858
youths|person|school performance and grades|concept|studies with over 600 youths reported on school performance and grades|082d9c930de94b838325d47e9fd07a3b
youths|person|organizational skills interventions|concept|meta-analysis of ten studies with 893 youths reported that organizational skills interventions led to moderate reductions in parent-reported attention symptoms|082d9c930de94b838325d47e9fd07a3b
youths|person|neurofeedback|concept|meta-analysis of five randomized controlled trials with 263 participants exploring the efficacy of neurofeedback found a small reduction in inattention|082d9c930de94b838325d47e9fd07a3b
youths|person|cognitive training|concept|meta-analysis of cognitive training and neurofeedback for youth found no significant reduction in ADHD symptoms|082d9c930de94b838325d47e9fd07a3b
youths|person|verbal working memory|concept|meta-analysis of cognitive training and neurofeedback for youth found moderate improvements in verbal working memory|082d9c930de94b838325d47e9fd07a3b
youths|person|academic outcomes|concept|meta-analysis of cognitive training and neurofeedback for youth found no significant effects on academic outcomes in math and reading|082d9c930de94b838325d47e9fd07a3b
adhd symptoms|condition|meta-analysis|documents|found no significant reduction in|e95f557d44844a448da5a8e4d6b2ac32
working memory training|service|verbal working memory|concept|led to short-term improvements in|e95f557d44844a448da5a8e4d6b2ac32
working memory training|service|visuospatial working memory|concept|led to short-term improvements in|e95f557d44844a448da5a8e4d6b2ac32
adhd symptoms|condition|omega-3 fatty acid supplementation|documents|associated with small-to-medium improvements|989da4bdba29477e8fd8467838ff3dec
adhd symptoms|condition|restricting synthetic food colors|service|associated with a small reduction|989da4bdba29477e8fd8467838ff3dec
adhd symptoms|condition|exercise|service|associated with a moderate reduction|989da4bdba29477e8fd8467838ff3dec
parent-rated emotional lability symptoms|documents|omega-3 fatty acid supplements|documents|found no evidence of any effect|989da4bdba29477e8fd8467838ff3dec
teacher-rated emotional lability symptoms|documents|omega-3 fatty acid supplements|documents|found no evidence of any effect|989da4bdba29477e8fd8467838ff3dec
parent-rated oppositional symptoms|documents|omega-3 fatty acid supplements|documents|found no evidence of any effect|989da4bdba29477e8fd8467838ff3dec
teacher-rated oppositional symptoms|documents|omega-3 fatty acid supplements|documents|found no evidence of any effect|989da4bdba29477e8fd8467838ff3dec
exercise|concept|hyperactiv ity/impulsivity|condition|no significant effect|65e86de9f5f2404a96aa9f1928d6df00
exercise|concept|inattention symptoms|condition|no significant effect|65e86de9f5f2404a96aa9f1928d6df00
exercise|concept|anxiety|condition|significant reductions|65e86de9f5f2404a96aa9f1928d6df00
exercise|concept|depression|condition|significant reductions|65e86de9f5f2404a96aa9f1928d6df00
inattention|condition|unhealthy dietary habits|documents|Both had significant associations with unhealthy diets.|2593721cf18b4bd18e3453f00aabeb58
inattention|condition|eating foods high in added sugar|concept|Even for persons with inattention symptoms, adjusted correlations were small, with the strongest associations being for overall unhealthy eating habits and eating foods high in added sugar.|2593721cf18b4bd18e3453f00aabeb58
hyperactivity/impulsivity subtypes|condition|unhealthy dietary habits|documents|Both had significant associations with unhealthy diets.|2593721cf18b4bd18e3453f00aabeb58
hyperactivity/impulsivity subtypes|condition|eating foods high in added sugar|concept|The association with consumption of foods high in added sugar became statistically insignificant.|2593721cf18b4bd18e3453f00aabeb58
monozygotic twins|location|inattention symptoms and unhealthy eating habits|condition and documents|"Among over 700 pairs of monozygotic (""identical"") twins, it found small but robust associations between inattention symptoms and unhealthy eating habits, and especially with consumption of foods high in added sugar."|2593721cf18b4bd18e3453f00aabeb58
adhd|concept|added sugar|condition|The consumption of foods high in added sugar became statistically insignificant for ADHD.|03a1918a583946148ea4d855f8e1a432
adhd|concept|li et al.|documents|A study by Li et al. (2020) found that the association with consumption of foods high in added sugar became statistically insignificant for ADHD.|03a1918a583946148ea4d855f8e1a432
adhd|condition|disorder|concept|is a type of|c1fada04452f4de99a5188fec80f4057
adhd|condition|symptoms|concept|causes|c1fada04452f4de99a5188fec80f4057
inattention and/or hyperactivity/impulsivity|concept|adhd|condition|are symptoms of|c1fada04452f4de99a5188fec80f4057
childhood or early adolescence|date|adhd|condition|is a stage when ADHD starts|c1fada04452f4de99a5188fec80f4057
youth and adults worldwide|location|adhd|condition|are affected by ADHD in|c1fada04452f4de99a5188fec80f4057
genetic risk factors|concept|cause of adhd|edge concept|contribute to the development of|c1fada04452f4de99a5188fec80f4057
brain networks and cognitive processes|concept|adhd|condition|are affected in people with ADHD|c1fada04452f4de99a5188fec80f4057
school failure, antisocial behavior, other psychiatric problems, somatic disorders, drug and alcohol abuse, accidental injuries, premature death|concept|adhd|condition|are risk factors associated with ADHD|c1fada04452f4de99a5188fec80f4057
medications|service|treating adhd and preventing adverse outcomes|concept|are effective for|c1fada04452f4de99a5188fec80f4057
non-medication treatments|service|reducing inattention, hyperactivity, and impulsivity|concept|are less effective for|c1fada04452f4de99a5188fec80f4057
evidence|documents|adhd|condition|has taught us about the disorder and its various manifestations|c1fada04452f4de99a5188fec80f4057
culture|concept|adhd symptoms|condition|affects the expression of|93f2d16dafb54dcfbe16818dbba73cf5
cultural context|location|adhd symptoms|condition|generalizing our assertions to other groups|93f2d16dafb54dcfbe16818dbba73cf5
males|person|adhd research|service|far more research pertains to|93f2d16dafb54dcfbe16818dbba73cf5
females|person|adhd research|service|less research compared to males|93f2d16dafb54dcfbe16818dbba73cf5
older adults|date|adhd|condition|we also need to learn more about ADHD in|93f2d16dafb54dcfbe16818dbba73cf5
adhd|concept|genes and environment|object|combine to cause the disorder and affect the brain to produce symptoms and impairments|cd55aad633494df1b6416762b85a7016
adhd|concept|oxidative stress|condition|may be shared with ADHD's somatic comorbidities|cd55aad633494df1b6416762b85a7016
adhd|concept|inflammation|condition|may be shared with ADHD's somatic comorbidities|cd55aad633494df1b6416762b85a7016
adhd|concept|insulin resistance|condition|may be shared with ADHD's somatic comorbidities|cd55aad633494df1b6416762b85a7016
biological and psychological causal mechanisms|concept|points of intervention that will improve the effectiveness of medical and non-medical treatments and prevent onset of the disorder|object|find to improve the effectiveness of medical and non-medical treatments and, eventually, prevent onset of the disorder|cd55aad633494df1b6416762b85a7016
medications that treat adhd|concept|misuse and diversion of these medications|condition|need better methods to prevent the misuse and diversion of these medications, especially among adolescents and young adults|cd55aad633494df1b6416762b85a7016
method of diagnosing adhd|concept|predictor of treatment response|object|is highly valid as a predictor of treatment response, family history of ADHD, many clinical features, measures of brain structure and function, and adverse outcomes|cd55aad633494df1b6416762b85a7016
new directions for diagnosis|concept|better understand the nature and causes of emotional symptoms in adhd and whether these should be incorporated into diagnostic criteria|object|one is to better understand the nature and causes of emotional symptoms in ADHD and whether these should be incorporated into diagnostic criteria|cd55aad633494df1b6416762b85a7016
new directions for diagnosis|concept|determine if and how mild or sub-threshold cases of adhd should be diagnosed and treated|object|another is to determine if and how mild or sub-threshold cases of ADHD should be diagnosed and treated|cd55aad633494df1b6416762b85a7016
adhd|condition|diagnosis|concept|Researchers are trying to develop computerized or biological tests for diagnosis of ADHD.|3ae7ef58d8e14221967d8b5cba6099eb
adhd|condition|treatment|concept|Different trajectories of ADHD across the life-cycle need to be further investigated for treatment.|3ae7ef58d8e14221967d8b5cba6099eb
adhd|condition|researchers|person|Many researchers are trying to develop computerized or biological tests using information about the patient's behavior, brain and/or genetic makeup.|3ae7ef58d8e14221967d8b5cba6099eb
adhd|condition|clinicians|person|Others are working on methods that use the vast data available from medical records to assist clinicians.|3ae7ef58d8e14221967d8b5cba6099eb
diagnosis|concept|prediction|concept|The hope is that such tests will one day diagnose the disorder, predict a personalized approach to treatment.|3ae7ef58d8e14221967d8b5cba6099eb
treatment|concept|personalized approach|concept|The hope is that such tests will one day diagnose the disorder, predict a personalized approach to treatment.|3ae7ef58d8e14221967d8b5cba6099eb
adhd|condition|adverse outcomes later in life|outcome|patients with ADHD are at greatest risk for adverse outcomes later in life|2b566557fb1c43cf958de6c960d3c0c0
adhd|condition|healthcare systems|organization|such work may someday allow healthcare systems to allocate resources to the highest risk patients|2b566557fb1c43cf958de6c960d3c0c0
adhd treatments|service|new medications currently in development|concept|the future of treatment for ADHD will include new medications currently in development|2b566557fb1c43cf958de6c960d3c0c0
adhd symptoms or associated impairments|condition|trigeminal nerve stimulation|concept|such as trigeminal nerve stimulation (McGough et al., 2019) and game-based treatments|2b566557fb1c43cf958de6c960d3c0c0
adhd symptoms or associated impairments|condition|acupuncture, yoga, and ayurvedic therapies|concept|And more data are needed to improve existing non-medication treatments and to test the efficacy of traditional therapies such as acupuncture|2b566557fb1c43cf958de6c960d3c0c0
somatic disorders that co-occur with adhd|condition|treatments for adhd|service|how the somatic disorders that co-occur with ADHD interact with treatments for ADHD|2b566557fb1c43cf958de6c960d3c0c0
duration of treatment|concept|outcomes over longer periods of time|outcome|We need to learn more about how duration of treatment affects outcomes over longer periods of time|2b566557fb1c43cf958de6c960d3c0c0
stigma and adhd|condition|socially and clinically important outcomes|outcome|Stigmatizing attitudes toward ADHD are common and may play a role in socially and clinically important outcomes|2b566557fb1c43cf958de6c960d3c0c0
adhd|concept|patients|entity|affect at all stages of their life|79f821d46ab844439f71f049821a6b9e
individuals|person|at all ages|concept|have been documented|79f821d46ab844439f71f049821a6b9e
family|organization|peers|person|including family, peers, teachers, clinicians, and even individuals with ADHD themselves|79f821d46ab844439f71f049821a6b9e
adhd|concept|syndrome|concept|the first textbook description of an ADHD-like syndrome|79f821d46ab844439f71f049821a6b9e
statements|documents|adhd|concept|make us confident that the contemporary diagnosis of the disorder is a|79f821d46ab844439f71f049821a6b9e
category|concept|world|location|can be used around|059681324c86475ebbb754288a0851d7
people|entity|disorder|condition|suffer from|059681324c86475ebbb754288a0851d7
lives|concept|people|entity|improve the lives of|059681324c86475ebbb754288a0851d7
attention deficit hyperactivity disorder|condition|hyperactivity|behavioral symptom|is a symptom of|34dd81de776541e392a077f1c254d061
attention deficit hyperactivity disorder|condition|inattention|behavioral symptom|is a symptom of|34dd81de776541e392a077f1c254d061
attention deficit hyperactivity disorder|condition|impulsivity|behavioral symptom|is a symptom of|34dd81de776541e392a077f1c254d061
hyperactivity|behavioral symptom|cognitive functioning|functioning|affects|34dd81de776541e392a077f1c254d061
inattention|behavioral symptom|cognitive functioning|functioning|affects|34dd81de776541e392a077f1c254d061
impulsivity|behavioral symptom|behavioral functioning|functioning|affects|34dd81de776541e392a077f1c254d061
care coordination|service|chronic condition management|management|is similar to|34dd81de776541e392a077f1c254d061
care coordination|service|information provision|service|includes providing information|34dd81de776541e392a077f1c254d061
adhd|condition|patient|person|involves treatment|f331a580d0384b8d97eb9605248e6aba
adhd|condition|caregivers|organization|involves involvement|f331a580d0384b8d97eb9605248e6aba
patient|person|clinician|service|evaluates treatment options together|f331a580d0384b8d97eb9605248e6aba
caregivers|organization|child|entity|determines target outcomes in collaboration with|f331a580d0384b8d97eb9605248e6aba
adhd|condition|school|location|may involve school-based interventions|f331a580d0384b8d97eb9605248e6aba
adhd|condition|improved relationships with caregivers, teachers, siblings, or peers|concept|can be addressed as a target outcome|8a679e654f604db2a0676482b037f6c1
adhd|condition|improved academic performance|concept|can be addressed as a target outcome|8a679e654f604db2a0676482b037f6c1
adhd|condition|improved rule following|concept|can be addressed as a target outcome|8a679e654f604db2a0676482b037f6c1
adhd|condition|treatment of coexisting conditions|service|may influence the treatment for ADHD|8a679e654f604db2a0676482b037f6c1
coexisting condition|condition|adhd|condition|can coexist with ADHD|8a679e654f604db2a0676482b037f6c1
treatment of coexisting conditions|service|adhd treatment|service|may be necessary for managing the full spectrum of symptoms in children with ADHD and coexisting conditions|8a679e654f604db2a0676482b037f6c1
sleep problems|condition|adhd symptoms|concept|may improve ADHD symptoms|8a679e654f604db2a0676482b037f6c1
brief behavioral sleep intervention|service|improved sleep|concept|can be used to treat sleep problems in children with ADHD|8a679e654f604db2a0676482b037f6c1
adhd|condition|children|entity|Children with ADHD|dffe73a8c2cd4589ac4829690c68bdc8
sleep intervention|service|children|entity|Intervention provided to children|dffe73a8c2cd4589ac4829690c68bdc8
methylphenidate|documents|pharmacotherapy|service|Children receiving methylphenidate as part of pharmacotherapy|dffe73a8c2cd4589ac4829690c68bdc8
clinician|person|consultations|service|Trained clinician providing consultations to children|dffe73a8c2cd4589ac4829690c68bdc8
teacher-reported behavior|concept|children in intervention group|entity|Children in intervention group showed improvements in teacher-reported behavior|dffe73a8c2cd4589ac4829690c68bdc8
specialist|person|consultation|service|Specialists providing consultation to children with ADHD|dffe73a8c2cd4589ac4829690c68bdc8
child psychologist|person|consultation|service|Child psychologists providing consultation to children with ADHD|dffe73a8c2cd4589ac4829690c68bdc8
oppositional defiant disorder|condition|substance abuse|condition|Coexisting psychiatric conditions, both disorders are mentioned in the context of ADHD|251d7d231e2e4c0c936518a5d00582e3
emotional problems|condition|oppositional defiant disorder|condition|Coexisting psychiatric conditions, both disorders are mentioned in the context of ADHD|251d7d231e2e4c0c936518a5d00582e3
conduct disorder|condition|substance abuse|condition|Coexisting psychiatric conditions, both disorders are mentioned in the context of ADHD|251d7d231e2e4c0c936518a5d00582e3
seizures|medical condition|autism spectrum disorder|neurodevelopmental condition|Coexisting neurodevelopmental, neurologic, or medical conditions, both disorders are mentioned in the context of ADHD|251d7d231e2e4c0c936518a5d00582e3
tics|medical condition|autism spectrum disorder|neurodevelopmental condition|Coexisting neurodevelopmental, neurologic, or medical conditions, both disorders are mentioned in the context of ADHD|251d7d231e2e4c0c936518a5d00582e3
learning disorders|medical condition|autism spectrum disorder|neurodevelopmental condition|Coexisting neurodevelopmental, neurologic, or medical conditions, both disorders are mentioned in the context of ADHD|251d7d231e2e4c0c936518a5d00582e3
sleep disorder|medical condition|autism spectrum disorder|neurodevelopmental condition|Coexisting neurodevelopmental, neurologic, or medical conditions, both disorders are mentioned in the context of ADHD|251d7d231e2e4c0c936518a5d00582e3
intellectual disabilities|medical condition|autism spectrum disorder|neurodevelopmental condition|Coexisting neurodevelopmental, neurologic, or medical conditions, both disorders are mentioned in the context of ADHD|251d7d231e2e4c0c936518a5d00582e3
stimulant therapy|treatment|atomoxetine|treatment|Lack of response to a controlled trial of stimulant therapy or atomoxetine, both treatments are mentioned in the context of ADHD|251d7d231e2e4c0c936518a5d00582e3
trauma|psychosocial condition|complex psychosocial circumstances|psychosocial condition|Complex psychosocial circumstances, trauma is mentioned as an example of such conditions|251d7d231e2e4c0c936518a5d00582e3
adhd|condition|behavior management|service|For preschool children with ADHD, we recommend parent training in behavior management as the initial therapy.|abdea22740f94eb5a6254fcac695100e
adhd|condition|medication|service|The addition of medication to behavior therapy may be indicated if target behaviors do not improve with behavioral therapy alone and the child's function continues to be impaired.|abdea22740f94eb5a6254fcac695100e
behavior management|service|caregiver|person|Behavior therapy can be administered by the caregivers or teachers following consultation with a behavioral therapist.|abdea22740f94eb5a6254fcac695100e
adhd|condition|guidelines|documents|The recommendations included in this topic review are consistent with the recommendations of these groups.|abdea22740f94eb5a6254fcac695100e
adhd|condition|society for developmental and behavioral pediatrics|organization|The Society for Developmental and Behavioral Pediatrics have guidelines and processes of care algorithms for evaluation and management of children with complex ADHD.|abdea22740f94eb5a6254fcac695100e
adhd|condition|preschool or daycare|location|There is a significant risk of injury to self, other children, or caregivers in preschool or daycare when a child has ADHD.|80a85f62e5894cd58ea9ef8465aae84c
adhd|condition|central nervous system injury|condition|Suspected or established central nervous system injury can lead to ADHD symptoms.|80a85f62e5894cd58ea9ef8465aae84c
adhd|condition|medications|documents|Methylphenidate is a medication suggested for preschool children with ADHD.|80a85f62e5894cd58ea9ef8465aae84c
autism spectrum disorder|condition|adhd|condition|Children diagnosed with ADHD during the preschool or early school years may no longer meet criteria for ADHD after school entry, and may be diagnosed with autism spectrum disorder instead.|80a85f62e5894cd58ea9ef8465aae84c
learning disorders|condition|adhd|condition|Children diagnosed with ADHD during the preschool or early school years may no longer meet criteria for ADHD after school entry, and may be diagnosed with learning disorders instead.|80a85f62e5894cd58ea9ef8465aae84c
anxiety|condition|adhd|condition|Children diagnosed with ADHD during the preschool or early school years may no longer meet criteria for ADHD after school entry, and may be diagnosed with anxiety instead.|80a85f62e5894cd58ea9ef8465aae84c
ptbm (behavior therapy)|service|adhd symptoms|condition|PTBM is a treatment suggested to improve core ADHD symptoms and target specific criteria for medication.|80a85f62e5894cd58ea9ef8465aae84c
preschool children|population|adhd symptoms|condition|ADHD symptoms interfere with other needed therapies in preschool children.|80a85f62e5894cd58ea9ef8465aae84c
stimulant medication|medication|ptbm (behavior therapy)|therapy|combined to improve core symptoms|f754d2be25f54b729510953cb5d93488
stimulant medication|medication|core symptoms|condition|improve|f754d2be25f54b729510953cb5d93488
ptbm (behavior therapy)|therapy|target outcomes|condition|target|f754d2be25f54b729510953cb5d93488
nonstimulant medications|medication|certain children|entity|may be more appropriate for|f754d2be25f54b729510953cb5d93488
comorbid conditions|condition|specific treatment approach|service|must be considered in selecting a|f754d2be25f54b729510953cb5d93488
patient values and preferences|entity|medication initiation|service|critical factors in deciding whether to initiate|f754d2be25f54b729510953cb5d93488
caregiver decision|decision|medication initiation|service|must be respected|f754d2be25f54b729510953cb5d93488
children|entity|adhd criteria|concept|do not meet|610edbe98dc04bf3acb42261c53688dd
behavioral interventions|service|children with problematic behavior|entity|recommended for|610edbe98dc04bf3acb42261c53688dd
adhd treatment plan|concept|adherence to the treatment plan|condition|should be monitored regularly|610edbe98dc04bf3acb42261c53688dd
therapy (medications)|service|adverse effects of therapy|concept|monitored for|610edbe98dc04bf3acb42261c53688dd
target goals and core symptoms|concept|response to therapy|condition|achievement of|610edbe98dc04bf3acb42261c53688dd
selected management strategy|service|attainment of the target outcome|concept|should be reevaluated if not attained|610edbe98dc04bf3acb42261c53688dd
children|entity|medication|documents|should receive medication|50323a698c74475eafc71a553c452e8f
monitoring schedule|service|pharmacotherapy stage|concept|depends on the stage of pharmacotherapy|50323a698c74475eafc71a553c452e8f
titration stage|concept|weekly monitoring|service|requires weekly monitoring|50323a698c74475eafc71a553c452e8f
maintenance phase|concept|monthly/quarterly monitoring|service|requires monthly or quarterly monitoring|50323a698c74475eafc71a553c452e8f
response to treatment|condition|core symptoms reduction|concept|is demonstrated by a 40-50% reduction in core symptoms|50323a698c74475eafc71a553c452e8f
adhd rating scales|documents|core symptoms monitoring|service|can be used to monitor core symptoms|50323a698c74475eafc71a553c452e8f
daily report card|documents|target goals monitoring|service|can be used to monitor target goals|50323a698c74475eafc71a553c452e8f
national institute for children's health quality|organization|treatment|service|availability of treatment through|13bb43cf2274443c8c32780de92ecd7d
inadequate response to treatment|condition|treatment|service|ineffectiveness or lack of response due to|13bb43cf2274443c8c32780de92ecd7d
coexisting conditions|condition|attention deficit hyperactivity disorder in children and adolescents: clinical features and diagnosis|document|related to|71e828b104844058a0aa2670bd02e053
nonadherence to the treatment plan|condition|treatment plan|service|caused by|71e828b104844058a0aa2670bd02e053
