node_1|node_1_type|node_2|node_2_type|edge|chunk_id
adhd|condition|intensity|condition|ADHD requires intensity|743ea67f19fa42a3951c1c6e31558c42
adhd|condition|duration|condition|ADHD requires duration|743ea67f19fa42a3951c1c6e31558c42
adhd|condition|number of sessions|condition|ADHD requires number of sessions|743ea67f19fa42a3951c1c6e31558c42
l-deprenyl|service|efficacy in treating adhd|concept|L-deprenyl has little evidence of efficacy in treating ADHD|743ea67f19fa42a3951c1c6e31558c42
pargyline|service|efficacy in treating adhd|concept|pargyline has little evidence of efficacy in treating ADHD|743ea67f19fa42a3951c1c6e31558c42
modafinil|service|efficacy in treating adhd|concept|modafinil has little evidence of efficacy in treating ADHD|743ea67f19fa42a3951c1c6e31558c42
cholinesterase inhibitors|service|efficacy in treating adhd|concept|cholinesterase inhibitors have little evidence of efficacy in treating ADHD|743ea67f19fa42a3951c1c6e31558c42
tetrahydrocannabinol (marijuana)|service|benefits for adhd|concept|tetrahydrocannabinol (marijuana) has few studies supporting benefits for ADHD|743ea67f19fa42a3951c1c6e31558c42
adhd|condition|cognitive functions|concept|Impair|9affdbf581dc465faf3958cde8583856
cannabis use|service|adhd|condition|Acute impair|9affdbf581dc465faf3958cde8583856
stimulants|documents|adhd|condition|Treatment for a time-limited period|9affdbf581dc465faf3958cde8583856
cognitive-behavioral therapy (cbt)|documents|adhd|condition|Treatment for executive dysfunction|9affdbf581dc465faf3958cde8583856
medication management|service|adhd|condition|Initial treatment with medication and CBT|9affdbf581dc465faf3958cde8583856
therapy|concept|executive dysfunction|condition|targets|ae1935ec911447de9e07a542fb09d1ee
amphetamines|service|methylphenidate|service|is preferred over|ae1935ec911447de9e07a542fb09d1ee
pharmacologic treatment|concept|specific populations|entity|may be the preferred initial therapy for|ae1935ec911447de9e07a542fb09d1ee
co-occurring substance use or substance use disorder (sud)|condition|adhd|condition|may have|ae1935ec911447de9e07a542fb09d1ee
stabilizing sud|concept|treating adhd|concept|should be done prior to|ae1935ec911447de9e07a542fb09d1ee
substance use disorder|condition|benzodiazepines|substance|has history of|c03e40406b0049feac151e78c802d9c8
substance use disorder|condition|alcohol|substance|has history of|c03e40406b0049feac151e78c802d9c8
substance use disorder|condition|opioids|substance|has history of|c03e40406b0049feac151e78c802d9c8
substance use disorder|condition|stimulants|substance|has history of|c03e40406b0049feac151e78c802d9c8
bupropion|drug|depression|condition|treats|c03e40406b0049feac151e78c802d9c8
bupropion|drug|adhd|condition|treats|c03e40406b0049feac151e78c802d9c8
stimulant|drug|anxiety disorders|condition|treats|c03e40406b0049feac151e78c802d9c8
selective serotonin reuptake inhibitor (ssri)|drug|anxiety disorders|condition|treats|c03e40406b0049feac151e78c802d9c8
methylphenidate|drug|pregnancy|condition|has risks for|c03e40406b0049feac151e78c802d9c8
amphetamines|drug|pregnancy|condition|preferred treatment in|c03e40406b0049feac151e78c802d9c8
adjustment|concept|vocational activities|activity|is particularly for|d5d100effef546c8b363ab17e72ed342
initial treatment|treatment|individuals with a suboptimal response|group of people|we review the accuracy of the diagnosis|d5d100effef546c8b363ab17e72ed342
comorbid disease|condition|adherence to medication|aspect of treatment|and we address these as indicated|d5d100effef546c8b363ab17e72ed342
adjunctive psychotherapy|treatment|initial treatment with medication alone|type of treatment|we suggest augmentation with CBT|d5d100effef546c8b363ab17e72ed342
cognitive behavioral therapy (cbt)|treatment|executive functioning|aspect of brain function|targeting this aspect appears to be the most efficacious treatment|d5d100effef546c8b363ab17e72ed342
combination therapy|treatment|adults with adhd|group of people|appears to be the most efficacious treatment for this group|d5d100effef546c8b363ab17e72ed342
methylphenidate|concept|cbt|concept|alternative treatment when CBT is not available|5e7ee6d58e084aff81fde8cbcba59705
atomoxetine|concept|bupropion|concept|successive trials for poor response to stimulants|5e7ee6d58e084aff81fde8cbcba59705
nortriptyline|concept|cbt|concept|augmentation with CBT for poor response to stimulants|5e7ee6d58e084aff81fde8cbcba59705
bupropion|concept|tricyclic antidepressant|concept|type of medication for ADHD in adults|5e7ee6d58e084aff81fde8cbcba59705
adhd medications|"object|entity|location|organization|person|condition|documents|concept|date"|methylphenidate-based medications|"object|entity|location|organization|person|condition|documents|concept|date"|ADHD medications help manage ADHD symptoms, which can be treated with Methylphenidate-based medications|d0830b7fbe764b6f9893b89f42404272
methylphenidate-based medications|"object|entity|location|organization|person|condition|documents|concept|date"|stimulants|"object|entity|location|organization|person|condition|documents|concept|date"|Methylphenidate-based medications are a type of stimulant used to treat ADHD|d0830b7fbe764b6f9893b89f42404272
short-acting methylphenidate|"object|entity|location|organization|person|condition|documents|concept|date"|methylphenidate-based medications|"object|entity|location|organization|person|condition|documents|concept|date"|Short-acting methylphenidate is a form of Methylphenidate-based medication that works for about 3-4 hours|d0830b7fbe764b6f9893b89f42404272
ritalin®|"object|entity|location|organization|person|condition|documents|concept|date"|short-acting methylphenidate|"object|entity|location|organization|person|condition|documents|concept|date"|Ritalin is a short-acting form of methylphenidate-based medication that works for about 3-4 hours|d0830b7fbe764b6f9893b89f42404272
methylin®|"object|entity|location|organization|person|condition|documents|concept|date"|short-acting methylphenidate|"object|entity|location|organization|person|condition|documents|concept|date"|Methylin is another form of short-acting methylphenidate-based medication|d0830b7fbe764b6f9893b89f42404272
ritalin®|"object|entity|location|organization|person|condition|documents|concept|date"|methylphenidate-based medications|"object|entity|location|organization|person|condition|documents|concept|date"|Ritalin is a form of Methylphenidate-based medication that can help improve attention and focus|d0830b7fbe764b6f9893b89f42404272
methylin®|"object|entity|location|organization|person|condition|documents|concept|date"|methylphenidate-based medications|"object|entity|location|organization|person|condition|documents|concept|date"|Methylin is a form of Methylphenidate-based medication that can help improve attention and focus|d0830b7fbe764b6f9893b89f42404272
long-acting medications|concept|reduce the need to take multiple doses throughout the day|condition|are designed to work for a longer period|9e5864a64c4b495c8163b8ff4b356f8f
long-acting medications|concept|doses|concept|typically last 8 -12 hours|9e5864a64c4b495c8163b8ff4b356f8f
methylphenidate|concept|long-acting medications|concept|is a type of long-acting medication|9e5864a64c4b495c8163b8ff4b356f8f
concerta|"documents|service"|methylphenidate|concept|is a brand name for Methylphenidate|9e5864a64c4b495c8163b8ff4b356f8f
extended-release tablets|"documents|service"|concerta|"documents|service"|is a form of Concerta|9e5864a64c4b495c8163b8ff4b356f8f
doses|concept|5mg and 10mg|"object|entity"|are available in different amounts|9e5864a64c4b495c8163b8ff4b356f8f
ritalin|"documents|service"|methylphenidate|concept|is similar to Methylphenidate|9e5864a64c4b495c8163b8ff4b356f8f
medication|concept|daytrana|service|Provides a steady release of medication throughout the day|269551830018408a9b046876a1db94f8
daytrana|service|patches|documents|The patch is applied to the skin and worn for about 9 hours|269551830018408a9b046876a1db94f8
daytrana|service|children|entity|This form is beneficial for children who have difficulty swallowing pills|269551830018408a9b046876a1db94f8
apten sio xr|concept|capsules|documents|Capsules can be opened and sprinkled on applesauce if the child cannot swallow them whole|269551830018408a9b046876a1db94f8
apten sio xr|concept|children|entity|Capsules can be opened and sprinkled on applesauce if the child cannot swallow them whole|269551830018408a9b046876a1db94f8
quillivant xr|concept|liquid|documents|The liquid form can be easier for children who have difficulty with pills|269551830018408a9b046876a1db94f8
focalin xr|concept|capsules|documents|Capsules can be opened and sprinkled on applesauce if the child cannot swallow them whole|269551830018408a9b046876a1db94f8
ritalin la|concept|capsules|documents|Long-acting capsules for managing symptoms with just one dose|269551830018408a9b046876a1db94f8
methylphenidate|"object|concept|medication"|symptom control|"condition|concept"|The long-acting form helps provide consistent symptom control throughout the day.|540e4246e3e145ac98d72f803db765c5
methylphenidate|"object|concept|medication"|daily timing|"concept|schedule"|Take the medication at the same time each day to maintain a steady level in your body.|540e4246e3e145ac98d72f803db765c5
methylphenidate|"object|concept|medication"|side effects|"condition|concept"|Common side effects of methylphenidate-based medications include: Decreased appetite, Insomnia or trouble sleeping, Headache, Stomachache, Increased heart rate.|540e4246e3e145ac98d72f803db765c5
amphetamine|"object|concept|medication"|attention and impulsivity|"condition|concept"|These medications increase the levels of certain chemicals in the brain to help improve attention and reduce impulsivity and hyperactivity.|540e4246e3e145ac98d72f803db765c5
amphetamine|"object|concept|medication"|short-acting amphetamines|"object|concept|medication"|Short-acting amphetamines typically work for about 4-6 hours.|540e4246e3e145ac98d72f803db765c5
adderall|"object|concept|medication"|form and doses|"concept|property"|The form is tablets, and the doses are 5mg, 7.5mg, 10mg, 12.5mg, 15mg, 20mg, 30mg.|540e4246e3e145ac98d72f803db765c5
adderall|documents|form|concept|Adderall has a form of tablets.|fa16dae3eabc4ec98330260afed73078
adderall|documents|doses|concept|Adderall is available in different doses such as 5mg, 7.5mg, 10mg, 12.5mg, 15mg, 20mg, and 30mg.|fa16dae3eabc4ec98330260afed73078
form|concept|usage|concept|The form of Adderall is related to its usage, which is usually taken 1-2 times a day.|fa16dae3eabc4ec98330260afed73078
doses|concept|usage|concept|The different doses of Adderall are related to its usual usage, which is 1-2 times a day.|fa16dae3eabc4ec98330260afed73078
procentra|documents|children who have trouble swallowing pills|person|is useful for|aa5131af41ae4fd58d7a0445378e9765
procentra|documents|bubblegum flavor|concept|has a flavor of|aa5131af41ae4fd58d7a0445378e9765
evekeo|documents|symptoms throughout the day|condition|is used to help manage|aa5131af41ae4fd58d7a0445378e9765
zenzedi|documents|symptoms of adhd|condition|helps manage symptoms of|aa5131af41ae4fd58d7a0445378e9765
adderall xr|documents|morning|concept|is taken once a day in|aa5131af41ae4fd58d7a0445378e9765
adderall xr|documents|symptoms with just one dose|condition|can help manage symptoms with|aa5131af41ae4fd58d7a0445378e9765
vyvanse|documents|morning|concept|is taken once a day in|aa5131af41ae4fd58d7a0445378e9765
doses|concept|mydayis|product|contains different doses|cefb7732dc154314b2cdbf71c6b529fc
doses|concept|dyanavel xr|product|includes various dose options|cefb7732dc154314b2cdbf71c6b529fc
mydayis|product|adzenys xr -odt|product|both provide extended symptom control|cefb7732dc154314b2cdbf71c6b529fc
dexedrine spansule|product|mydayis|product|similar in terms of providing extended symptom control|cefb7732dc154314b2cdbf71c6b529fc
tips for using amphetamine-based medications|concept|dexedrine spansule|product|advice on how to use amphetamine-based medications|cefb7732dc154314b2cdbf71c6b529fc
form|concept|adzenys xr -odt|product|available in orally disintegrating tablets (orange flavor)|cefb7732dc154314b2cdbf71c6b529fc
doses|concept|adzenys xr -odt|product|offers various dose options|cefb7732dc154314b2cdbf71c6b529fc
usage|concept|mydayis|product|taken once a day in the morning|cefb7732dc154314b2cdbf71c6b529fc
amphetamine|medication|side effects|condition|amphetamine causes side effects|f20dee64760d4d8b813b3826d91f034c
stimulant medications|medication|non-stimulant medications|medication|stimulant medications are different from non-stimulant medications|f20dee64760d4d8b813b3826d91f034c
strattera (atomoxetine)|medication|non-stimulant medications|medication|Strattera is a type of non-stimulant medication|f20dee64760d4d8b813b3826d91f034c
intuniv (guanfacine)|medication|non-stimulant medications|medication|Intuniv is a type of non-stimulant medication|f20dee64760d4d8b813b3826d91f034c
norepinephrine|chemical|strattera (atomoxetine)|medication|Strattera increases the levels of norepinephrine|f20dee64760d4d8b813b3826d91f034c
adhd|condition|stimulant medications|medication|stimulant medications are used to treat ADHD|f20dee64760d4d8b813b3826d91f034c
children and adolescents|entity|intuniv|documents|Children and Adolescents use Intuniv|48631afec97a4ba19ce18373eb1d7f4b
intuniv|documents|brain|concept|Intuniv works by affecting receptors in the brain that help regulate attention and impulse control|48631afec97a4ba19ce18373eb1d7f4b
kapvay|documents|brain|concept|Kapvay works by stimulating receptors in the brain to reduce hyperactivity and improve attention|48631afec97a4ba19ce18373eb1d7f4b
qelbree|documents|brain|concept|Qelbree helps manage ADHD symptoms by modulating the levels of certain neurotransmitters in the brain|48631afec97a4ba19ce18373eb1d7f4b
children and adolescents|entity|kapvay|documents|Children and Adolescents use Kapvay|48631afec97a4ba19ce18373eb1d7f4b
qelbree|documents|children (6 -11 years)|entity|Children (6 -11 years) use Qelbree|48631afec97a4ba19ce18373eb1d7f4b
qelbree|documents|adolescents (12 -17 years)|entity|Adolescents (12 -17 years) use Qelbree|48631afec97a4ba19ce18373eb1d7f4b
qelbree|documents|adults|entity|Adults use Qelbree|48631afec97a4ba19ce18373eb1d7f4b
qelbree|concept|adhd symptoms|condition|helps manage|8080c27bab024aecb2c80da434daca58
neurotransmitters|documents|brain|location|modulate levels in|8080c27bab024aecb2c80da434daca58
adhd medications|concept|side effects|condition|can cause|8080c27bab024aecb2c80da434daca58
medication|documents|child|person|effective and well-tolerated by|8080c27bab024aecb2c80da434daca58
loss of appetite (anorexia)|condition|weight loss|condition|related to|8080c27bab024aecb2c80da434daca58
child|entity|weight|concept|Regularly check your child's weight to ensure they are on a normal growth curve.|b01c671553d84818b81c0a748702fe5f
child|entity|meal timing|concept|Give the medication with meals to reduce its impact on appetite.|b01c671553d84818b81c0a748702fe5f
child|entity|medication|documents|Administer stimulants earlier in the day to minimize sleep disruption.|b01c671553d84818b81c0a748702fe5f
child|entity|sleep habits|concept|Encourage a consistent sleep schedule, limit caffeine, and reduce screen time before bed.|b01c671553d84818b81c0a748702fe5f
medication|documents|melatonin|concept|Discuss with your healthcare provider the possibility of using melatonin, low-dose clonidine, guanfacine, or mirtazapine at bedtime to aid sleep.|b01c671553d84818b81c0a748702fe5f
medication|documents|clonidine|concept|Discuss with your healthcare provider the possibility of using melatonin, low-dose clonidine, guanfacine, or mirtazapine at bedtime to aid sleep.|b01c671553d84818b81c0a748702fe5f
medication|documents|guanfacine|concept|Discuss with your healthcare provider the possibility of using melatonin, low-dose clonidine, guanfacine, or mirtazapine at bedtime to aid sleep.|b01c671553d84818b81c0a748702fe5f
medication|documents|mirtazapine|concept|Discuss with your healthcare provider the possibility of using melatonin, low-dose clonidine, guanfacine, or mirtazapine at bedtime to aid sleep.|b01c671553d84818b81c0a748702fe5f
medication|documents|blood pressure|concept|Check these regularly, especially if dizziness persists.|b01c671553d84818b81c0a748702fe5f
medication|documents|heart rate|concept|Check these regularly, especially if dizziness persists.|b01c671553d84818b81c0a748702fe5f
dizziness|condition|hydration|service|Hydration can help alleviate dizziness|44c4b88ee47d4c90bbf1299aabc79d76
snacks|"documents|concept"|dizziness|condition|Consuming snacks may help reduce dizziness|44c4b88ee47d4c90bbf1299aabc79d76
extended-release form|"documents|concept"|medication|service|Using an extended-release form of medication can provide a stable release|44c4b88ee47d4c90bbf1299aabc79d76
irritability|condition|moodiness|condition|Irritability and moodiness are related side effects of medication|44c4b88ee47d4c90bbf1299aabc79d76
medication form adjustment|service|medication|service|Adjusting the medication form may help manage its side effects|44c4b88ee47d4c90bbf1299aabc79d76
irritability|condition|medication|concept|The irritability could be related to the medication.|c1d78a0ef02d47b399339866b71bbc1b
medication|concept|mood disorder|condition|Changing the medication type or form might help if there's an underlying mood disorder.|c1d78a0ef02d47b399339866b71bbc1b
growth problems|concept|medication|concept|Stimulant medications can slightly impact a child's growth in height and weight.|c1d78a0ef02d47b399339866b71bbc1b
heart symptoms|condition|medication|concept|Symptoms like heart pounding, dizziness, nearly fainting, or chest pain are serious but rare and could be related to the medication.|c1d78a0ef02d47b399339866b71bbc1b
headaches|condition|medication|concept|Headaches can happen, particularly soon after taking the medication.|c1d78a0ef02d47b399339866b71bbc1b
stomachaches|condition|medication|concept|Stomachaches can be a common side effect of the medication.|c1d78a0ef02d47b399339866b71bbc1b
timing with meals|concept|medication|documents|Give the medication with or after breakfast|8c4790e91b6a4c3ba9f5ad9737e528f0
antacids|documents|stomach discomfort|condition|Use to alleviate stomach discomfort|8c4790e91b6a4c3ba9f5ad9737e528f0
zom bie effect|concept|medication|documents|Side effect of medication|8c4790e91b6a4c3ba9f5ad9737e528f0
children|person|become unusually quiet or appear over-focused|condition| exhibit the 'zombie' effect due to ADHD medication|cbb8fe14ad5a4afc8d070a764968782c
children|person|monitor for changes in behavior and report to the healthcare provider|service|require observation for behavioral changes due to ADHD medication|cbb8fe14ad5a4afc8d070a764968782c
stimulants|medication|motor or vocal tics|condition|can cause or worsen in children due to ADHD medication|cbb8fe14ad5a4afc8d070a764968782c
stimulants|medication|monitor your child closely for new or worsening tics|service|require monitoring for tics due to ADHD medication|cbb8fe14ad5a4afc8d070a764968782c
stimulants|medication|discuss with the healthcare provider about adjusting or switching medications if tics become problematic|service|require medication adjustment due to worsening tics in children|cbb8fe14ad5a4afc8d070a764968782c
children|person|loss of appetite (anorexia), weight loss|condition|may experience reduced appetite and weight loss due to ADHD medication|cbb8fe14ad5a4afc8d070a764968782c
children|person|regularly check your child's weight to ensure they are growing normally|service|require monitoring of weight due to reduced appetite in children|cbb8fe14ad5a4afc8d070a764968782c
children|person|administer the stimulant with meals to lessen its impact on appetite|service|require meal timing due to reduced appetite in children|cbb8fe14ad5a4afc8d070a764968782c
children|person|offer high-calorie snacks such as instant breakfast drinks|documents|require calorie-enhanced snacks due to reduced appetite in children|cbb8fe14ad5a4afc8d070a764968782c
instant breakfast drinks|documents|evening|condition|are offered in|9b35dd48cf4a4529815a36145002c3e6
frozen yogurt|documents|evening|condition|are offered in|9b35dd48cf4a4529815a36145002c3e6
cereals|documents|evening|condition|are offered in|9b35dd48cf4a4529815a36145002c3e6
good sleep habits|concept|consistent sleep schedule|concept|encourage|9b35dd48cf4a4529815a36145002c3e6
good sleep habits|concept|avoid caffeine|concept|encourage|9b35dd48cf4a4529815a36145002c3e6
good sleep habits|concept|limit naps to less than 45 minutes|concept|encourage|9b35dd48cf4a4529815a36145002c3e6
good sleep habits|concept|reduce screen time before bed|concept|encourage|9b35dd48cf4a4529815a36145002c3e6
timing of medication|concept|medication adjustments|concept|Timing of medication and medication adjustments are related as they both discuss strategies for minimizing the impact of stimulant medications on a child's sleep.|8e8e68bb051848bf9e8c0c23d3302230
supplemental medications|concept|dizziness|condition|Supplemental medications and dizziness are related as they both discuss potential side effects of medication, with supplemental medications providing a possible solution to mitigate the symptoms of dizziness.|8e8e68bb051848bf9e8c0c23d3302230
medication form adjustment|concept|dizziness|condition|Medication form adjustment and dizziness are related as they both discuss strategies for managing dizziness, with medication form adjustment being a possible solution to stabilize the release of medication.|8e8e68bb051848bf9e8c0c23d3302230
growth problems|concept|medication adjustments|concept|Growth problems and medication adjustments are related as they both discuss potential side effects of stimulant medications, with growth problems being a possible consequence of long-term use.|8e8e68bb051848bf9e8c0c23d3302230
supplemental medications|concept|more irritability or moodiness when taking medication|condition|Supplemental medications and more irritability or moodiness when taking medication are related as they both discuss potential side effects of medication, with supplemental medications providing a possible solution to mitigate the symptoms of increased irritability.|8e8e68bb051848bf9e8c0c23d3302230
more irritability or moodiness when taking medication|condition|medication adjustment|concept|More irritability or moodiness when taking medication and medication adjustment are related as they both discuss strategies for managing the side effect of increased irritability, with medication adjustment being a possible solution to change the preparation or type of medication.|8e8e68bb051848bf9e8c0c23d3302230
growth problems|concept|medication adjustments|concept|Growth problems and medication adjustments are related as they both discuss potential side effects of stimulant medications, with growth problems being a possible consequence of long-term use.|8e8e68bb051848bf9e8c0c23d3302230
child's height|concept|stimulant medications|concept|can slightly impact|21f401d972004cc99ffab2b6978795c6
child's weight|concept|stimulant medications|concept|can slightly impact|21f401d972004cc99ffab2b6978795c6
regular measurement|service|child's height|concept|should be performed every six months to track growth|21f401d972004cc99ffab2b6978795c6
regular measurement|service|child's weight|concept|should be performed every six months to track growth|21f401d972004cc99ffab2b6978795c6
medication holidays|service|stimulant medications|concept|can allow for normal growth on weekends or during school vacations|21f401d972004cc99ffab2b6978795c6
heart symptoms|condition|cardiovascular issues|condition|might indicate serious but rare symptoms|21f401d972004cc99ffab2b6978795c6
immediate action|service|medication|concept|should be stopped and a healthcare provider should be contacted immediately if Heart Symptoms are experienced|21f401d972004cc99ffab2b6978795c6
atomoxetine|medication|excessive tiredness|side effect|Common side effect associated with Atomoxetine|a964c866a39d4d8dbe21b4224135d11c
excessive tiredness|side effect|start with a low dose and gradually increase|management strategy|Recommended management strategy for Excessive Tiredness|a964c866a39d4d8dbe21b4224135d11c
excessive tiredness|side effect|this side effect usually improves over time|management strategy|Recommended management strategy for Excessive Tiredness|a964c866a39d4d8dbe21b4224135d11c
excessive tiredness|side effect|some children do better with the daily dose divided into two doses|management strategy|Recommended management strategy for Excessive Tiredness|a964c866a39d4d8dbe21b4224135d11c
insomnia|side effect|encourage good sleep habits|management strategy|Recommended management strategy for Insomnia|a964c866a39d4d8dbe21b4224135d11c
insomnia|side effect|adjust the timing of the dose|management strategy|Recommended management strategy for Insomnia|a964c866a39d4d8dbe21b4224135d11c
stomachaches, nausea|side effect|give medication with food to minimize stomach discomfort|management strategy|Recommended management strategy for Stomachaches, Nausea|a964c866a39d4d8dbe21b4224135d11c
stomachaches, nausea|side effect|consult with the healthcare provider for further advice|management strategy|Recommended management strategy for Stomachaches, Nausea|a964c866a39d4d8dbe21b4224135d11c
headaches|side effect|monitor headaches and consult with the healthcare provider|management strategy|Recommended management strategy for Headaches|a964c866a39d4d8dbe21b4224135d11c
headaches|side effect|adjusting the dose or timing may help|management strategy|Recommended management strategy for Headaches|a964c866a39d4d8dbe21b4224135d11c
irritability or aggression (infrequent)|side effect|monitor irritability and consult with the healthcare provider|management strategy|Recommended management strategy for Irritability or Aggression|a964c866a39d4d8dbe21b4224135d11c
irritability|condition|aggression|condition|irritability can lead to aggression|aed33595825541b2acfc6fa64f2b41a5
