node_1|node_1_type|node_2|node_2_type|edge|chunk_id
treatment|concept|slowing of heart rate|condition|side effect of treatment, slowing of heart rate occurs|3aa0fdfe27e94483a8e12c662a5b4903
dose|documents|treatment|concept|component of treatment, dose is involved in it|3aa0fdfe27e94483a8e12c662a5b4903
time|date|dose|documents|parameter of dose, time plays a role in its decrease|3aa0fdfe27e94483a8e12c662a5b4903
slowing of heart rate|condition|treatment|concept|symptom or effect caused by treatment, slowing of heart rate occurs|3aa0fdfe27e94483a8e12c662a5b4903
dizziness|condition|treatment|concept|side effect of treatment, dizziness is experienced|3aa0fdfe27e94483a8e12c662a5b4903
adhd|condition|parents' concerns|entity|Should be discussed with primary care practitioner, etc.|f32394c19717405c8fa3e4ca3dd1e848
primary care practitioner|person|comprehensive evaluation|documents|Can guide in obtaining|f32394c19717405c8fa3e4ca3dd1e848
child and adolescent psychiatrist|person|children with adhd|entity|Can benefit from careful medication management|f32394c19717405c8fa3e4ca3dd1e848
psychotherapy|service|behavioral, emotional, and academic issues|concept|Can be conducted by licensed mental health practitioner|f32394c19717405c8fa3e4ca3dd1e848
chadd website|documents|information about adhd|service|Can be a helpful source of information|f32394c19717405c8fa3e4ca3dd1e848
child|entity|adhd|condition|is experiencing ADHD|ff2a64fc4e7d4aa68509d36006085462
chadd|organization|resources|documents|website provides resources for ADHD treatment|ff2a64fc4e7d4aa68509d36006085462
medication|service|adhd|condition|is used to treat ADHD|ff2a64fc4e7d4aa68509d36006085462
child|entity|medication|service|refuses to take medication|ff2a64fc4e7d4aa68509d36006085462
side effects|condition|medication|service|are associated with taking medication for ADHD|ff2a64fc4e7d4aa68509d36006085462
adhd treatment|concept|education planning|documents|is well-studied and effective in treating ADHD|ff2a64fc4e7d4aa68509d36006085462
medications for children with adhd|documents|accommodations for children with adhd|concept|well-studied, effective, and safe|c6461666b048410c857c45f53d2a74be
stimulants|medications|long-term side effects|condition|no unexpected long-term side effects of stimulants that one does not see in the short term|c6461666b048410c857c45f53d2a74be
lowered appetite|condition|stimulants|medications|may continue longer term|c6461666b048410c857c45f53d2a74be
side effects|condition|medications for children with adhd|documents|most side effects can be managed with little to no long-term problems related to the medication|c6461666b048410c857c45f53d2a74be
motor tics|condition|children with adhd|concept|About one-third of children with ADHD will have spasm-like movements in the face, mouth, or upper body|c6461666b048410c857c45f53d2a74be
medications for adhd|documents|motor tics|condition|Changes in tics may occur naturally, or may be related to medication|c6461666b048410c857c45f53d2a74be
generic medications|documents|brand name medications|concept|similar to brand name medications in several important ways|c6461666b048410c857c45f53d2a74be
brand name medications|concept|generic medications|documents|which are also available at pharmacies|c6461666b048410c857c45f53d2a74be
generic medication|object|brand medication|object|are effective and less expensive compared to brand medication|65ad7b85a4b043b8b619859bda301a11
generic medication|object|release form of medication|concept|differences in the way that medication is released can affect generic medications|65ad7b85a4b043b8b619859bda301a11
generic medication|object|humidity and light conditions|condition|different conditions such as humidity and light can affect tablets of generic medications|65ad7b85a4b043b8b619859bda301a11
generic medication|object|side effects|concept|differences in side effects between generic and brand medications|65ad7b85a4b043b8b619859bda301a11
pharmacies|organization|generic medication preparations|object|pharmacies frequently switch among generic products|65ad7b85a4b043b8b619859bda301a11
attention-deficit/hyperactivity disorder (adhd)|condition|american academy of child and adolescent psychiatry adhd resource center|organization|resource center for ADHD|f79a6d4cdfe146e8a0328c3af1582bca
attention-deficit/hyperactivity disorder (adhd)|condition|the american professional society of adhd and related disorders (apsard)|organization|professional society for ADHD|f79a6d4cdfe146e8a0328c3af1582bca
attention-deficit/hyperactivity disorder (adhd)|condition|attention deficit disorder association (adda)|organization|resource center for ADHD|f79a6d4cdfe146e8a0328c3af1582bca
american academy of child and adolescent psychiatry adhd resource center|organization|the american professional society of adhd and related disorders (apsard)|organization|professional society for ADHD|f79a6d4cdfe146e8a0328c3af1582bca
american academy of child and adolescent psychiatry adhd resource center|organization|attention deficit disorder association (adda)|organization|resource center for ADHD|f79a6d4cdfe146e8a0328c3af1582bca
the american professional society of adhd and related disorders (apsard)|organization|attention deficit disorder association (adda)|organization|resource center for ADHD|f79a6d4cdfe146e8a0328c3af1582bca
attention-deficit/hyperactivity disorder (adhd)|condition|centers for disease control and prevention (cdc) adhd|organization|resource center for ADHD|f79a6d4cdfe146e8a0328c3af1582bca
attention-deficit/hyperactivity disorder (adhd)|condition|children and adults with attention-deficit/ hyperactivity disorder (chadd)|organization|resource center for ADHD|f79a6d4cdfe146e8a0328c3af1582bca
centers for disease control and prevention (cdc) adhd|organization|children and adults with attention-deficit/ hyperactivity disorder (chadd)|organization|resource center for ADHD|f79a6d4cdfe146e8a0328c3af1582bca
attention-deficit/hyperactivity disorder (adhd)|condition|national institute of mental health (nimh) adhd|organization|resource center for ADHD|f79a6d4cdfe146e8a0328c3af1582bca
attention-deficit/hyperactivity disorder (adhd)|condition|barkley r. taking charge of adhd, third edition: the complete, authoritative guide for parents|documents|book about ADHD|f79a6d4cdfe146e8a0328c3af1582bca
attention-deficit/hyperactivity disorder (adhd)|condition|wilens te, hammerness pg. straight talk about psychiatric medications for kids, 4th edition|documents|book about ADHD|f79a6d4cdfe146e8a0328c3af1582bca
adhd|condition|neurodevelopmental condition|concept|ADHD is a type of neurodevelopmental condition.|3f75399f2eb34351b1b002d5779017fe
adhd|condition|genetic variants|concept|ADHD has a predominantly genetic aetiology that involves common and rare genetic variants.|3f75399f2eb34351b1b002d5779017fe
environmental correlates|concept|disorder|condition|Some environmental correlates of the disorder have been discovered but causation has been difficult to establish.|3f75399f2eb34351b1b002d5779017fe
symptoms|concept|impairment|condition|The diverse presentation of symptoms and levels of impairment are evident in the condition.|3f75399f2eb34351b1b002d5779017fe
mental conditions|concept|physical conditions|concept|Numerous co-occurring mental and physical conditions are present in the condition.|3f75399f2eb34351b1b002d5779017fe
neurocognitive impairment|concept|domains|concept|The various domains of neurocognitive impairment are present in the condition.|3f75399f2eb34351b1b002d5779017fe
minor structural and functional brain differences|concept|condition|adhd|Extensive minor structural and functional brain differences are present in ADHD.|3f75399f2eb34351b1b002d5779017fe
diagnosis of adhd|concept|standard diagnostic criteria|concept|The diagnosis of ADHD is reliable and valid when evaluated with standard diagnostic criteria.|3f75399f2eb34351b1b002d5779017fe
curative treatments for adhd|concept|symptoms|condition|Curative treatments for ADHD do not exist but evidence-based treatments substantially reduce symptoms.|3f75399f2eb34351b1b002d5779017fe
adhd|concept|medications|object|Effective for core symptoms|6677c2f879a0494c804f08b2ec9c6adb
adhd|concept|non-pharmacological treatments|documents/service|Especially for improving adaptive functioning|6677c2f879a0494c804f08b2ec9c6adb
clinical research|service/documents|therapeutic approaches|concept|Could lead to the creation of personalized diagnostic and therapeutic approaches|6677c2f879a0494c804f08b2ec9c6adb
mechanisms/pathophysiology|concept|neurobiological research|service/documents|Ongoing|6677c2f879a0494c804f08b2ec9c6adb
adhd|condition|remission|condition|is common in those who are in remission, and can occur even in those in full remission|576b57f777594a9388d2ea3ba0a71c53
severe adhd|condition|milder adhd|condition|has an earlier onset and a less fluctuating course through adulthood than milder ADHD|576b57f777594a9388d2ea3ba0a71c53
male-to-female sex ratio of adhd|concept|general population|location|is 2.4:1 in the general population|576b57f777594a9388d2ea3ba0a71c53
male-to-female sex ratio of adhd|concept|those seeking treatment|location|is much higher (4:1) in those seeking treatment|576b57f777594a9388d2ea3ba0a71c53
sex ratio of adhd|concept|adolescents|location|drops to 2:1 in adolescents|576b57f777594a9388d2ea3ba0a71c53
sex ratio of adhd|concept|adults|location|ranges from 1.9:1 to 1.2:1 in registry and claims data, and 1.1:1 in population surveys|576b57f777594a9388d2ea3ba0a71c53
adhd in females|condition|adhd diagnoses|concept|aligns more closely with the presentation of ADHD in females, and has a decreased emphasis on hyperactivity|576b57f777594a9388d2ea3ba0a71c53
parent referral for treatment|concept|self-referral|concept|is replaced by self-referral in adulthood, and women are more likely to seek professional help for mental health problems|576b57f777594a9388d2ea3ba0a71c53
adhd|condition|racial and ethnic minority populations|location|is under-diagnosed in Black, Hispanic, and other racial and ethnic minority populations|576b57f777594a9388d2ea3ba0a71c53
health-care disparities|condition|black and latin minority youth|person|have been documented to experience health-care disparities|59f5ecc543b84c7983f9cf315274d405
adhd|concept|children with many adhd symptoms|documents|are under-diagnosed among children with many ADHD symptoms|59f5ecc543b84c7983f9cf315274d405
adhd|concept|immigrants|person|is less likely to be diagnosed among immigrants than among non-immigrants|59f5ecc543b84c7983f9cf315274d405
black patients with adhd|person|white-majority countries|location|are significantly less likely to receive pharmacological treatment than white patients|59f5ecc543b84c7983f9cf315274d405
adhd|concept|certain ethnicities|person|may be improving in diagnosis among individuals of certain ethnicities|59f5ecc543b84c7983f9cf315274d405
adhd|concept|other psychiatric disorders|condition|often coexists with other psychiatric disorders|59f5ecc543b84c7983f9cf315274d405
comorbid conditions|condition|higher adhd symptom severity and poorer outcomes|documents|are associated with higher ADHD symptom severity and poorer outcomes|59f5ecc543b84c7983f9cf315274d405
adhd|concept|conduct disorder|condition|have a pooled odds ratio of 10.7 for conduct disorder|59f5ecc543b84c7983f9cf315274d405
adhd|concept|major depressive disorder|condition|have a pooled odds ratio of 5.5 for major depressive disorder|59f5ecc543b84c7983f9cf315274d405
adhd|concept|anxiety disorders|condition|have a pooled odds ratio of 3.0 for anxiety disorders|59f5ecc543b84c7983f9cf315274d405
adhd|concept|oppositional defiant disorder|condition|have a pooled odds ratio of ... for oppositional defiant disorder|59f5ecc543b84c7983f9cf315274d405
anxiety disorders|condition|adhd|concept|Comorbidity with ADHD|e5276d41114c4f079ee964c43c6d9116
major depressive disorder|condition|adhd|concept|Comorbidity with ADHD|e5276d41114c4f079ee964c43c6d9116
bipolar disorder|condition|adhd|concept|Comorbidity with ADHD|e5276d41114c4f079ee964c43c6d9116
substance use disorder|condition|adhd|concept|Comorbidity with ADHD|e5276d41114c4f079ee964c43c6d9116
dermatitis|somatic condition|adhd|concept|Comorbidity with ADHD in children and adolescents|e5276d41114c4f079ee964c43c6d9116
obesity|somatic condition|adhd|concept|Comorbidity with ADHD in children and adolescents|e5276d41114c4f079ee964c43c6d9116
asthma|somatic condition|adhd|concept|Comorbidity with ADHD in children and adolescents|e5276d41114c4f079ee964c43c6d9116
rhinitis|somatic condition|adhd|concept|Comorbidity with ADHD in children and adolescents|e5276d41114c4f079ee964c43c6d9116
type 2 diabetes mellitus|somatic condition|adhd|concept|Comorbidity with ADHD in adults|e5276d41114c4f079ee964c43c6d9116
cardiovascular disease|somatic condition|adhd|concept|Association with ADHD in adults|e5276d41114c4f079ee964c43c6d9116
vision problems|condition|adhd|concept|Associated with ADHD|e5276d41114c4f079ee964c43c6d9116
genetics|mechanism/pathophysiology|adhd|concept|Contributed to the development of ADHD|e5276d41114c4f079ee964c43c6d9116
adhd|condition|genetic factors|factor|The disorder is primarily influenced by genetic factors|8675bf47cddf415c849be40d78373008
inattention|symptom|adhd|condition|Attention-deficit/hyperactivity disorder (ADHD) is a common condition characterized by inattention|8675bf47cddf415c849be40d78373008
hyperactivity|symptom|adhd|condition|Attention-deficit/hyperactivity disorder (ADHD) is a common condition characterized by hyperactivity|8675bf47cddf415c849be40d78373008
impulsivity|symptom|adhd|condition|Attention-deficit/hyperactivity disorder (ADHD) is a common condition characterized by impulsivity|8675bf47cddf415c849be40d78373008
school failure|impairment|adhd|condition|The disorder is primarily influenced by genetic factors, but environmental factors also have a role|8675bf47cddf415c849be40d78373008
occupational failure|impairment|adhd|condition|The disorder is primarily influenced by genetic factors, but environmental factors also have a role|8675bf47cddf415c849be40d78373008
anxiety disorders|comorbidity|adhd|condition|Moreover, from many large, well-designed, epidemiological, clinical and longitudinal studies, we know the disorder’s comorbidities|8675bf47cddf415c849be40d78373008
mood disorders|comorbidity|adhd|condition|Moreover, from many large, well-designed, epidemiological, clinical and longitudinal studies, we know the disorder’s comorbidities|8675bf47cddf415c849be40d78373008
adhd|condition|dsm-5|documents|used for diagnosis|e8f281196837476b8cb072d000780335
icd-11|documents|adhd|condition|used for diagnosis|e8f281196837476b8cb072d000780335
measurement tools|service|adhd treatment outcomes|concept|assisted in monitoring|e8f281196837476b8cb072d000780335
clinical trials|documents|adhd treatments|concept|documented safety and efficacy|e8f281196837476b8cb072d000780335
genetics|service|adhd aetiology|concept|provided hints about mechanisms of disease onset|e8f281196837476b8cb072d000780335
imaging studies|service|mechanisms of disease onset|concept|provided hints|e8f281196837476b8cb072d000780335
clinical features|documents|adhd lifespan course|concept|much known about|e8f281196837476b8cb072d000780335
emotional dysregulation|condition|adhd|condition|association with ADHD|e8f281196837476b8cb072d000780335
age at onset variation|concept|adhd severity fluctuations|concept|in some individuals, symptom severity declines during adolescence|e8f281196837476b8cb072d000780335
adhd|concept|symptom severity|condition|declines during adolescence|c20d262d54484a21aab8aeae8cf1fc2f
adhd|concept|children|entity|retain impairing symptoms in adulthood at clinical or subthreshold levels|c20d262d54484a21aab8aeae8cf1fc2f
prevalence of adhd|concept|age|date|gradual decrease to 1% at older ages|c20d262d54484a21aab8aeae8cf1fc2f
diagnosis|service|children|entity|often delayed|c20d262d54484a21aab8aeae8cf1fc2f
inattentive|condition|boys|person|typically more than girls|c20d262d54484a21aab8aeae8cf1fc2f
diagnostic delays|concept|age at diagnosis|date|peak age at diagnosis is 9.5 years, with a median of 12 years|c20d262d54484a21aab8aeae8cf1fc2f
adhd symptoms|concept|impairment|condition|fluctuate over time within individual patients|c20d262d54484a21aab8aeae8cf1fc2f
weak support systems|condition|adhd symptoms and impairments|concept|worsen under certain conditions|c20d262d54484a21aab8aeae8cf1fc2f
adhd|condition|adhd symptoms|concept|The same genetic factors influence both the disorder of ADHD and lower levels of ADHD symptoms in the general population.|4df27c1dd878438eadab85dab875562c
adhd|condition|anxiety|concept|The co-occurrence of ADHD with other psychiatric disorders, including anxiety|4df27c1dd878438eadab85dab875562c
adhd|condition|major depressive disorder|concept|The co-occurrence of ADHD with other psychiatric disorders, including major depressive disorder|4df27c1dd878438eadab85dab875562c
adhd|condition|bipolar disorder|concept|The co-occurrence of ADHD with other psychiatric disorders, including bipolar disorder|4df27c1dd878438eadab85dab875562c
adhd|condition|conduct disorder|concept|The co-occurrence of ADHD with other psychiatric disorders, including conduct disorder|4df27c1dd878438eadab85dab875562c
adhd|condition|autism spectrum disorder|concept|The co-occurrence of ADHD with other psychiatric disorders, including autism spectrum disorder|4df27c1dd878438eadab85dab875562c
adhd|condition|substance use disorder|concept|The co-occurrence of ADHD with other psychiatric disorders, including substance use disorder|4df27c1dd878438eadab85dab875562c
adhd|condition|cognition|concept|The genetic association between ADHD and measures of cognition|4df27c1dd878438eadab85dab875562c
adhd|condition|eeg variability|concept|The genetic association between ADHD and electroencephalographic (EEG) variability|4df27c1dd878438eadab85dab875562c
adhd|condition|subtle structural brain differences|concept|The genetic association between ADHD and subtle structural brain differences|4df27c1dd878438eadab85dab875562c
adhd|condition|genetic liability|concept|There is a strong genetic link between clinically diagnosed ADHD and ADHD symptoms in the population.|63522617a5594e0185a48ca161e80b22
adhd|condition|educational attainment|concept|Higher ADHD polygenic scores are linked to worse cognitive performance and educational outcomes.|63522617a5594e0185a48ca161e80b22
adhd genetic liability|concept|mental conditions|condition|ADHD genetic liability is linked to many mental and somatic conditions.|63522617a5594e0185a48ca161e80b22
genetic variants|concept|intracranial brain volume|documents|Genetic variants implicated in ADHD are linked to smaller intracranial brain volume.|63522617a5594e0185a48ca161e80b22
adhd genetic risk|concept|brain-specific neuronal subtypes|documents|ADHD genetic risk is enriched for genes associated with several brain-specific neuronal subtypes.|63522617a5594e0185a48ca161e80b22
foxp1 and foxp2|concept|speech disorders|condition|Rare variants of FOXP1 and FOXP2 are linked to speech disorders.|63522617a5594e0185a48ca161e80b22
sorcs3, ptprf, and mef2c|concept|synaptic development|documents|Rare variants of SORCS3, PTPRF, and MEF2C are implicated in synaptic development.|63522617a5594e0185a48ca161e80b22
adhd|concept|genetic variants|documents|Studies found an increased burden of rare protein-truncating variants in evolutionarily constrained genes in ADHD|53749172127e40f6b152653b350c1f96
adhd|concept|autism spectrum disorder|concept|Many of the copy number variants implicated in ADHD are also found in autism spectrum disorder|53749172127e40f6b152653b350c1f96
adhd|concept|schizophrenia|concept|Many of the copy number variants implicated in ADHD are also found in schizophrenia|53749172127e40f6b152653b350c1f96
adhd|concept|brain development|condition|Studies converge on the conclusion that many ADHD risk loci implicate neurodevelopmental processes|53749172127e40f6b152653b350c1f96
adhd|concept|european ancestry|location|The majority of genetic studies of ADHD are largely based on samples of European ancestry|53749172127e40f6b152653b350c1f96
adhd|concept|genetic basis|documents|Progress in understanding the genetic basis of ADHD has generated hope that these findings may be used for patient stratification|53749172127e40f6b152653b350c1f96
adhd|concept|medications|documents|Polygenic scores or single genetic variants are not useful for choosing medications|53749172127e40f6b152653b350c1f96
genetic variation|concept|adhd|condition|cause of ADHD|457127a2916246ea9aec4d150d934c3f
environmental causes|concept|adhd|condition|associated with ADHD|457127a2916246ea9aec4d150d934c3f
traumatic brain injury|event|adhd|condition|can cause ADHD|457127a2916246ea9aec4d150d934c3f
extreme emotional and nutritional deprivation|event|adhd|condition|can cause ADHD|457127a2916246ea9aec4d150d934c3f
low birthweight|complication|adhd|condition|associated with ADHD|457127a2916246ea9aec4d150d934c3f
perinatal hypoxia|complication|adhd|condition|associated with ADHD|457127a2916246ea9aec4d150d934c3f
advanced paternal age|event|adhd|condition|can cause ADHD|457127a2916246ea9aec4d150d934c3f
socioeconomic status (ses)|concept|adhd|condition|associated with ADHD|457127a2916246ea9aec4d150d934c3f
low ses|status|high ses|status|twice as likely to have ADHD|457127a2916246ea9aec4d150d934c3f
adhd|condition|low educational and occupational under-attainment|concept|can have|457127a2916246ea9aec4d150d934c3f
ses|concept|adhd|concept|SES and ADHD each have a partly genetic basis|e1ab5b0608ce4ea9a524c95615183063
parents from low ses households|entity|adhd|concept|parents from low SES households impart a higher-than-average genetic risk of ADHD|e1ab5b0608ce4ea9a524c95615183063
age groups (years)|entity|adhd|concept|The age-dependent prevalence of ADHD in adulthood|e1ab5b0608ce4ea9a524c95615183063
ses (socioeconomic status)|concept|adhd (attention deficit hyperactivity disorder)|condition|The SES is associated with ADHD due to direct genetic parent-to-offspring transmission and environmental effects on mental health.|d87c8db5113a4847a700938beb8063e2
polygenic liability for adhd|concept|negative health behaviours|condition|The polygenic liability for ADHD is linked to negative health behaviors.|d87c8db5113a4847a700938beb8063e2
polygenic liability for adhd|concept|psychosocial impairment|condition|The polygenic liability for ADHD is linked to psychosocial impairment.|d87c8db5113a4847a700938beb8063e2
maternal smoking during pregnancy|documents|adhd (attention deficit hyperactivity disorder)|condition|Maternal smoking during pregnancy is associated with ADHD.|d87c8db5113a4847a700938beb8063e2
mother's polygenic risk for adhd|concept|maternal smoking during pregnancy|documents|The mother's polygenic risk for ADHD significantly predicts whether she smoked during pregnancy.|d87c8db5113a4847a700938beb8063e2
oocyte leading to pregnancy|concept|maternal smoking during pregnancy|documents|The oocyte leading to pregnancy was donated, which does not predict ADHD in offspring.|d87c8db5113a4847a700938beb8063e2
social factors|concept|resilience in those susceptible to adhd|condition|Social factors promote resilience in those susceptible to ADHD.|d87c8db5113a4847a700938beb8063e2
intellectual factors|concept|resilience in those susceptible to adhd|condition|Intellectual factors promote resilience in those susceptible to ADHD.|d87c8db5113a4847a700938beb8063e2
emotional factors|concept|resilience in those susceptible to adhd|condition|Emotional factors promote resilience in those susceptible to ADHD.|d87c8db5113a4847a700938beb8063e2
adhd|condition|resilience|concept|Factors promote resilience in those susceptible to ADHD|d2352bb874834f6598ecc9e784549173
scaffolding|concept|adhd|condition|Compensating resource prevents the emergence of symptoms|d2352bb874834f6598ecc9e784549173
social acceptance|service|scaffolding|concept|Implicated mechanism in scaffolding|d2352bb874834f6598ecc9e784549173
positive parenting|service|scaffolding|concept|Implicated mechanism in scaffolding|d2352bb874834f6598ecc9e784549173
self-perceptions of competence|concept|scaffolding|concept|Implicated mechanism in scaffolding|d2352bb874834f6598ecc9e784549173
electrophysiology|service|adhd|condition|Studies found a higher theta to beta ratio and differences in event-related potentials|d2352bb874834f6598ecc9e784549173
brain imaging|service|adhd|condition|Provided clues to the pathophysiology of ADHD|d2352bb874834f6598ecc9e784549173
children|"object|entity"|adhd|condition|found small to moderate structural brain differences|12ce3f498fc74dbe805c0395d9279bad
adolescents|"object|entity"|adhd|condition|not found structural brain differences|12ce3f498fc74dbe805c0395d9279bad
adults|"object|entity"|adhd|condition|not found structural brain differences|12ce3f498fc74dbe805c0395d9279bad
frontal region|location|executive functions|concept|important for|12ce3f498fc74dbe805c0395d9279bad
cingulate region|location|executive functions|concept|important for|12ce3f498fc74dbe805c0395d9279bad
parietal region|location|executive functions|concept|important for|12ce3f498fc74dbe805c0395d9279bad
temporal region|location|executive functions|concept|important for|12ce3f498fc74dbe805c0395d9279bad
fusiform gyrus|location|emotion processing|concept|important for|12ce3f498fc74dbe805c0395d9279bad
temporal pole|location|emotion processing|concept|important for|12ce3f498fc74dbe805c0395d9279bad
basal ganglia|location|adhd traits|condition|smaller volumes associated with|12ce3f498fc74dbe805c0395d9279bad
limbic volume|location|adhd traits|condition|smaller volumes associated with|12ce3f498fc74dbe805c0395d9279bad
cortical surface area|concept|adhd traits|condition|smaller areas associated with|12ce3f498fc74dbe805c0395d9279bad
ventromedial orbito-frontal cortical thickness|concept|adhd traits|condition|associated with|12ce3f498fc74dbe805c0395d9279bad
posterior corpus callosum|location|visual attention|concept|connecting to|12ce3f498fc74dbe805c0395d9279bad
